<meiQiReferrer xmlns:xsi="http://www.w3.org/2001/XMLSchema-instance"
	xsi:noNamespaceSchemaLocation="orderDetail.xsd">
	<sections>
		<sectionName>OrderDetailSection</sectionName>
		<sectionItems>
			<viewName>OrderDetailTipsCell</viewName>
			<data>
				<lblTips>
					${OrderItem.allDeliveryStatus(0,您的订单正在配送中，请注意查收。,)}${OrderItem.allDeliveryStatus(1,由于订单中商品所在库房不同，部分商品已先行发货，未发货商品也将尽快发货。,)}${OrderItem.allDeliveryStatus(2,由于订单中商品所在库房不同，此订单被分拆为,)}${OrderItem.allDeliveryStatus(2,OrderItem.deliverySize,)}${OrderItem.allDeliveryStatus(2,个配送单分开配送，请您谅解。,)}
				</lblTips>
			</data>
		</sectionItems>
		<sectionItems />
	</sections>
	<sections>
		<multItems>${OrderItem.deliverys}</multItems>
		<sectionName>OrderDetailSection</sectionName>
		<sectionItems>
			<viewName>OrderDetailTransportCodeCell</viewName>
			<data>
				<lblTransportCode>${OrderItem.deliverys[0].status(3,待发货商品)}${OrderItem.deliverys[0].status([012],配送单号：)}${OrderItem.deliverys[0].deliverySn}</lblTransportCode>
				<lblRedStatus>${OrderItem.deliverys[0].status(0,配送中)}${OrderItem.deliverys[0].status(2,生成发货单)}</lblRedStatus>
				<lblGreenStatus>${OrderItem.deliverys[0].status(1,配送完成)}</lblGreenStatus>
			</data>
		</sectionItems>
		<sectionItems>
			<multItems>${OrderItem.deliverys[0].carts}</multItems>
			<viewName>OrderDetailCartCell</viewName>
			<data>
				<imgvLeft>${OrderItem.deliverys[0].carts[0].goods.cover}</imgvLeft>
				<lblTitle>${OrderItem.deliverys[0].carts[0].goods.name}</lblTitle>
				<lblPrice>￥${OrderItem.deliverys[0].carts[0].goods.price}</lblPrice>
				<lblGoodsAmount>x${OrderItem.deliverys[0].carts[0].goodsAmount}</lblGoodsAmount>
				<lblStandardName>${OrderItem.deliverys[0].carts[0].goods.standardName}
				</lblStandardName>
			</data>
				<actions>
				<actionName>goodDetailCommand</actionName>
				<sender>OrderDetailCartCell</sender>
				<actionValue>${OrderItem.deliverys[0].carts[0].goods.goodsId}</actionValue>
			</actions>
			<actions/>
		</sectionItems>
		<sectionItems />
	</sections>
	<sections>
		<sectionName>OrderDetailSection</sectionName>
		<sectionItems>
			<viewName>OrderDetailConsigneeCell</viewName>
			<data>
				<lblLeft>收货人</lblLeft>
				<lblName>${OrderItem.consignee.name}</lblName>
				<lblPhone>${OrderItem.consignee.phone((\d{3})(\d{4})(\d{4}),$1****$3)}</lblPhone>
				<lblAddress>${OrderItem.consignee.detail}</lblAddress>
			</data>
		</sectionItems>
		<sectionItems />
	</sections>
	<sections>
		<sectionName>OrderDetailSection</sectionName>
		<sectionItems>
			<viewName>OrderDetailPayCell</viewName>
			<data>
				<lblPaymentsLabel>支付方式</lblPaymentsLabel>
				<lblPayments>在线支付</lblPayments>
			</data>
		</sectionItems>
		<sectionItems>
			<viewName>OrderDetailTransportInfoCell</viewName>
			<data>
				<lblTransportTypeLabel>配送方式</lblTransportTypeLabel>
				<lblTransportType>${OrderItem.shippingStr}</lblTransportType>
			</data>
		</sectionItems>
	</sections>
	<sections>
		<sectionName>OrderDetailSection</sectionName>
		<sectionItems>
			<viewName>OrderDetailRecordCell</viewName>
			<data>
				<lblLeftTop>订单编号：</lblLeftTop>
				<lblRightTop>${OrderItem.orderSn}</lblRightTop>
				<lblLeftBottom>下单时间：</lblLeftBottom>
				<lblRightBottom>${OrderItem.addTime}</lblRightBottom>
			</data>
		</sectionItems>
		<sectionItems>
			<viewName>OrderDetailPriceCell</viewName>
			<data>
				<lblGoodsPriceLabel>商品总额</lblGoodsPriceLabel>
                <lblgoodsPrice>￥${OrderItem.goodsPrice}</lblgoodsPrice>
                <lblTransportPriceLabel>运费</lblTransportPriceLabel>
                <lblTransportPrice>+￥${OrderItem.transportPrice}</lblTransportPrice>
                <lblDiscountPriceLabel>
                ${OrderItem.orderDiscount.discount((?!0+(?:\.0+)?$)\d+(?:\.\d+)?,折扣码优惠)}${OrderItem.orderDiscount.bonusDiscount((?!0+(?:\.0+)?$)\d+(?:\.\d+)?,\n红包优惠)}${OrderItem.orderDiscount.orderDiscount((?!0+(?:\.0+)?$)\d+(?:\.\d+)?,\n活动优惠)}
                </lblDiscountPriceLabel>
                <lblDiscountPrice>
                ${OrderItem.orderDiscount.discount((?!0+(?:\.0+)?$)\d+(?:\.\d+)?,-￥$0,)}${OrderItem.orderDiscount.bonusDiscount((?!0+(?:\.0+)?$)\d+(?:\.\d+)?,\n-￥$0,)}${OrderItem.orderDiscount.orderDiscount((?!0+(?:\.0+)?$)\d+(?:\.\d+)?,\n-￥$0,)}
                </lblDiscountPrice>
			</data>
		</sectionItems>
		<sectionItems>
			<viewName>OrderDetailTotalCell</viewName>
			<data>
				<lblAmountLabel>实付款</lblAmountLabel>
				<lblAmount>￥${OrderItem.amount}</lblAmount>
			</data>
		</sectionItems>
	</sections>
</meiQiReferrer>
